{"provider":"codex","title":"The effect of insufficient quadriceps strength on gait after anterior cruciate ligament reconstruction","source_pdf":"/Users/ryutt/Desktop/mini_ryutt/Walking/docs/ref_papers/01_acl_gait_biomechanics_studies/The effect of insufficient quadriceps strength on gait after anterior cruciate ligament reconstruction.pdf","source_summary_path":"/Users/ryutt/Desktop/mini_ryutt/Walking/2026-06-29-Study-review/mds/papers/10_The_effect_of_insufficient_quadriceps_strength_on_gait_after_anterior_cruciate_ligament_reconstruction.md","sections_checked":55,"issues_found":8,"overall_verdict":"신뢰 어려움","overall_verdict_reason":"대부분의 핵심 내용은 원문과 대체로 부합하지만, 레퍼런스 활용 문맥에서 원문보다 강한 인과·정상화·직접 원인 표현이 반복되고, 일부 방법 서술과 선행연구 서술에 의미를 바꾸는 오류가 있다. 중대 등급 finding이 포함되어 전체적으로 그대로 신뢰하기 어렵다.","findings":[{"section":"methods","quoted_summary_text":"관절 역학은 역동학을 사용하여 계산되었으며, 순 내부 모멘트로 정규화하여 표현되었다. _(근거: PAGE 4, 2.4. Data management and analysis)_","issue_type":"번역오류","severity":"경미","explanation":"원문은 관절 역학이 역동학으로 계산되고 순 내부 모멘트로 '표현'되었다고 하며, 정규화는 별도로 관절 모멘트를 체중×다리길이로 나누었다는 내용이다. 요약의 '순 내부 모멘트로 정규화'는 정규화 대상과 기준을 혼동한다.","source_evidence_quote":"Joint kinetics were calculated using inverse dynamics, and are expressed as net internal moments. Knee angles and moments were normalized to 100% of the stance phase of gait. Joint moments were normalized to the subject’s body mass multiplied by the leg length.","source_locator":"PAGE 4, 2.4. Data management and analysis","suggested_correction":"관절 역학은 역동학으로 계산되어 순 내부 모멘트로 표현되었고, 무릎 각도와 모멘트는 입각기 100%에 맞춰 정규화되었으며 관절 모멘트는 체중×다리길이로 정규화되었다."},{"section":"author_conclusion","quoted_summary_text":"전방십자인대 재건술 후 정상적인 관절 운동학, 운동역학 및 근육 활성도를 회복하기 위해서는 대퇴사두근 근력 강화가 필수적이다. _(근거: PAGE 7, 6. Discussion)_","issue_type":"과장","severity":"경미","explanation":"원문은 '강한 대퇴사두근이 필요해 보인다(appear to be necessary)'고 조심스럽게 표현한다. 요약은 '근력 강화가 필수적'이라고 하여 중재 자체와 필연성을 더 강하게 단정한다.","source_evidence_quote":"Strong quadriceps appear to be necessary to allow for a return of normal joint kinematics, kinetics and muscle activities following ACL reconstruction.","source_locator":"PAGE 7, 6. Discussion","suggested_correction":"전방십자인대 재건술 후 정상적인 관절 운동학, 운동역학 및 근육 활성도로 돌아가기 위해서는 강한 대퇴사두근이 필요해 보인다고 저자들은 해석하였다."},{"section":"prior_research_problems","quoted_summary_text":"전방십자인대 파열은 무릎 관절 연골의 조기 퇴행성 변화를 유발하는 것으로 선행 문헌에 보고되어 왔다. _(근거: PAGE 2, 1. Introduction)_","issue_type":"인과관계오용","severity":"중대","explanation":"원문은 ACL 파열이 조기 퇴행성 변화와 '관련되어 왔다(has been associated with)'고 말한다. 요약은 '유발'이라고 하여 연관성을 인과로 단정한다.","source_evidence_quote":"ACL rupture has been associated with early degenerative changes to the articular cartilage of the knee [1,22].","source_locator":"PAGE 2, 1. Introduction","suggested_correction":"전방십자인대 파열은 무릎 관절 연골의 조기 퇴행성 변화와 관련된 것으로 선행 문헌에 보고되어 왔다."},{"section":"study_solution_and_contribution","quoted_summary_text":"전방십자인대 재건 후 정상적인 보행 운동학 및 운동역학을 회복하기 위해서는 단순한 수술적 안정성 회복뿐만 아니라 강한 대퇴사두근의 확보가 동반되어야 함을 증명하였다. _(근거: PAGE 7, 6. Discussion)_","issue_type":"과장","severity":"중대","explanation":"원문은 'appear to be necessary'라는 해석적 표현이며, 연구 설계도 단면 비교 연구라서 '증명하였다'는 표현은 원문보다 강하다. 또한 원문에는 근육 활동까지 포함되어 있으나 요약은 이를 생략했다.","source_evidence_quote":"Strong quadriceps appear to be necessary to allow for a return of normal joint kinematics, kinetics and muscle activities following ACL reconstruction.","source_locator":"PAGE 7, 6. Discussion","suggested_correction":"전방십자인대 재건 후 정상적인 관절 운동학, 운동역학 및 근육 활동으로 돌아가기 위해서는 수술적 안정성 회복뿐 아니라 강한 대퇴사두근이 필요해 보인다는 근거를 제시하였다."},{"section":"study_solution_and_contribution","quoted_summary_text":"전방십자인대 부상이나 재건 후 대퇴사두근에 대한 신속한 강화 훈련이 고난도 스포츠나 활동으로 복귀할 때 안전성을 보장하는 데 기여함을 명시적으로 제시하였다. _(근거: PAGE 1, Relevance)_","issue_type":"과장","severity":"중대","explanation":"원문은 신속한 강화가 안전한 복귀에 '기여할 수 있다(may contribute)'고만 말한다. 요약의 '안전성을 보장'은 원문보다 훨씬 강한 단정이다.","source_evidence_quote":"Rapid strengthening following anterior cruciate ligament injury or reconstruction may contribute to a safe return to high-level activities.","source_locator":"PAGE 1, Relevance","suggested_correction":"전방십자인대 부상이나 재건 후 신속한 대퇴사두근 강화는 고난도 활동으로 안전하게 복귀하는 데 기여할 수 있다고 제시하였다."},{"section":"referenceable_claims","quoted_summary_text":"활용 맥락과 주의: 해외 선행연구의 분석에 근거하여, 수술로 무릎의 구조적 및 회복적 관절 안정성이 정상화되더라도 보행 상의 부적응 동작(예: 굴곡 감소, 모멘트 이상)은 그대로 유지될 수 있어 안정성이 모든 보행 적응의 주 원인이 아님을 설명할 때 사용한다. 2차 인용에 있어 Bulgheroni et al. (1997) 및 DeVita et al. (1997) 문헌을 점검해야 한다.","issue_type":"과장","severity":"경미","explanation":"원문은 'surgical restoration of knee stability'라고만 하며, 안정성이 '정상화'되었다거나 '구조적 및 회복적' 안정성이 정상화되었다고 표현하지 않는다. 또한 '그대로 유지'는 persist보다 강하게 들릴 수 있다.","source_evidence_quote":"Altered movement patterns persist following anterior cruciate ligament reconstruction [12,13] despite surgical restoration of knee stability. This suggests that instability is not the sole cause of the gait adaptations.","source_locator":"PAGE 2, 1. Introduction","suggested_correction":"활용 맥락과 주의: 선행연구에 따르면 수술로 무릎 안정성이 회복된 뒤에도 변형된 운동 패턴이 지속될 수 있어, 불안정성만으로 보행 적응을 설명하기 어렵다는 근거로 사용할 수 있다. 2차 인용 시 Bulgheroni et al. (1997) 및 DeVita et al. (1997) 원문을 점검해야 한다."},{"section":"referenceable_claims","quoted_summary_text":"활용 맥락과 주의: 전방십자인대 재건술 후 대퇴사두근 근력이 환측 대비 90% 이상 확보될 때에 한해서만 보행 및 운동 시 정상인 수준으로 무릎의 회전각과 굴곡 관절 모멘트 부하 능력이 온전히 회복된다는 직접적 근거로 활용할 수 있다.","issue_type":"과장","severity":"중대","explanation":"원문은 strong group의 무릎 각도와 모멘트가 걷기와 조깅의 초기 입각기에서 비손상군과 구별되지 않았다고 한다. '90% 이상일 때에 한해서만', '회전각', '부하 능력', '온전히 회복'은 원문 근거보다 강하거나 원문에 없는 표현이다.","source_evidence_quote":"Knee angles and moments of the strong group were indistinguishable from the uninjured group during early stance of both walking and jogging.","source_locator":"PAGE 1, Abstract","suggested_correction":"활용 맥락과 주의: 재건 후 대퇴사두근 근력이 비침범측의 90% 이상인 strong-ACLR 군에서 걷기와 조깅의 초기 입각기 무릎 각도와 모멘트가 비손상군과 구별되지 않았다는 직접 결과로 활용할 수 있다."},{"section":"referenceable_claims","quoted_summary_text":"활용 맥락과 주의: 대퇴사두근 근력 약화가 장기적인 무릎 관절염(osteoarthritis) 및 관절의 병리학적 변화의 발병에 직접적 원인 제공 혹은 추가 기여 요소로서 기능할 수 있다는 이론적이고 개연성 있는 가설을 지지하기 위한 주장으로 사용된다.","issue_type":"인과관계오용","severity":"중대","explanation":"원문은 조건부로 'might also contribute to increased risk'라고 하며, 직접적 원인 제공을 말하지 않는다. 요약은 '발병에 직접적 원인 제공'이라고 하여 원문의 가능성·위험 표현을 인과로 강화했다.","source_evidence_quote":"If quadriceps femoris weakness contributes to altered movements and muscular adaptations, then reduced quadriceps strength might also contribute to the increased risk of arthritic changes in patient populations following ACL rupture or reconstruction.","source_locator":"PAGE 2, 1. Introduction","suggested_correction":"활용 맥락과 주의: 대퇴사두근 약화가 변형된 움직임과 근육 적응에 기여한다면, ACL 파열 또는 재건 후 관절염적 변화 위험 증가에도 기여할 가능성이 있다는 이론적 가설을 설명할 때 사용할 수 있다."}],"unverifiable_items":[{"quoted_summary_text":"DOI: 확인 불가","reason":"SOURCE_TEXT에는 DOI가 제시되어 있지 않아 DOI 존재 여부를 원문만으로 확인할 수 없다."},{"quoted_summary_text":"원본 파일: /Users/ryutt/Desktop/mini_ryutt/Walking/docs/ref_papers/01_acl_gait_biomechanics_studies/The effect of insufficient quadriceps strength on gait after anterior cruciate ligament reconstruction.pdf","reason":"SOURCE_TEXT는 논문 텍스트만 포함하며 로컬 파일 경로의 실제 원본 여부는 확인할 수 없다."},{"quoted_summary_text":"분석 provider: antigravity","reason":"SOURCE_TEXT에는 요약 작성 또는 분석 provider에 관한 정보가 없다."}]}