{"provider":"codex","title":"Bilateral Gait Six and Twelve Months Post-ACL Reconstruction Compared to Controls","source_pdf":"/Users/ryutt/Desktop/mini_ryutt/Walking/docs/ref_papers/01_acl_gait_biomechanics_studies/Bilateral Gait Six and Twelve Months Post-ACL Reconstruction Compared to Controls.pdf","source_summary_path":"/Users/ryutt/Desktop/mini_ryutt/Walking/2026-06-29-Study-review/mds/papers/02_Bilateral_Gait_Six_and_Twelve_Months_Post_ACL_Reconstruction_Compared_to_Controls.md","sections_checked":28,"issues_found":4,"overall_verdict":"일부 수정 필요","overall_verdict_reason":"대부분의 핵심 내용은 원문과 일치하지만, 일부 핵심 결과에서 유의한 구간이 빠졌고, 몇몇 표현이 원문보다 강하게 서술되었다. 중대 등급의 사실 왜곡은 확인되지 않았다.","findings":[{"section":"key_results","quoted_summary_text":"ACLR 수술측 무릎은 대조군에 비해 수술 후 6개월 및 12개월 시점 모두 초기 입각기(1-30%)에서 수직 지면 반력(vGRF)이 감소했고, 중간 입각기(6개월: 33-64%, 12개월: 33-69%)에서는 수직 지면 반력이 대조군보다 유의하게 컸다. _(근거: PAGE 6, RESULTS - Vertical ground reaction force)_","issue_type":"누락","severity":"경미","explanation":"원문은 수술측 vGRF가 초기 입각기에서 감소하고 중간 입각기에서 증가했다고 보고할 뿐 아니라, 6개월과 12개월 모두 후기 입각기에서 감소했고 12개월에는 입각기 매우 말기에서 증가했다고도 보고한다. 요약은 이 유의한 후기/말기 구간을 생략하여 결과 범위가 축소되었다.","source_evidence_quote":"At 6 months (Figure 1E) the involved limbs in the ACLR cohort demonstrated lesser vGRF compared to uninjured control limbs during early (1–30%) and late (74–84%) stance and greater vGRF in mid-stance (33–64%). At 12 months (Figure 1F), the involved limbs demonstrated lesser vGRF during early (1–30%) and late (77–82%) stance and greater vGRF during mid-stance (33–69%) and at the very end of stance (93–94%).","source_locator":"PAGE 6, RESULTS - Vertical ground reaction force","suggested_correction":"ACLR 수술측 무릎은 대조군에 비해 6개월과 12개월 모두 초기 입각기에서 vGRF가 감소하고 중간 입각기에서 증가했으며, 6개월에는 후기 입각기(74-84%)에서, 12개월에는 후기 입각기(77-82%)에서 감소하고 매우 말기(93-94%)에는 증가했다."},{"section":"key_results","quoted_summary_text":"수술측 내부 무릎 신전 모멘트(KEM)는 대조군에 비해 6개월 및 12개월 시점 입각기 전반부(각각 8-37%, 2-42%)에서 감소한 반면, 입각기 중-후반부(6개월: 53-89%, 12개월: 68-71%) 영역에서는 대조군보다 컸다. _(근거: PAGE 7, RESULTS - Internal knee extension moment)_","issue_type":"누락","severity":"경미","explanation":"원문은 12개월 시점 수술측 KEM이 중-후반부 일부 구간에서 증가했지만, 입각기 매우 말기(92-100%)에는 대조군보다 낮았다고 추가로 보고한다. 요약은 이 말기 감소 결과를 생략했다.","source_evidence_quote":"At 12 months following ACLR, the involved limbs demonstrated a lesser KEM compared to uninjured controls limbs in the first half of stance (2–42%), greater KEM during mid to late stance (68–71%) and lesser KEM at the very end of stance (92–100%, Figure 3F).","source_locator":"PAGE 7, RESULTS - Internal knee extension moment","suggested_correction":"수술측 KEM은 대조군에 비해 6개월에는 입각기 전반부(8-37%)에서 낮고 후반부(53-89%)에서 높았으며, 12개월에는 전반부(2-42%)에서 낮고 중-후반부 일부(68-71%)에서 높았지만 매우 말기(92-100%)에는 다시 낮았다."},{"section":"study_solution_and_contribution","quoted_summary_text":"사후 분석으로 6개월에서 12개월 사이 환자들의 보행 속도 미세 감소 현상을 활용한 회귀 분석을 실시해, 비수술측(대측) 무릎의 피크 수직 지면 반력(vGRF) 변량의 32.5%, 피크 무릎 신전 모멘트(KEM) 변량의 28.6%가 보행 속도 변화와 깊은 연관이 있음을 정량화하여 종단 보행 데이터 분석에서 속도 변수 고려의 중요성을 제안했다. _(근거: PAGE 7-8, RESULTS - Post Hoc Analysis)_","issue_type":"과장","severity":"경미","explanation":"원문은 비수술측 ΔvGRF와 ΔKEM이 Δspeed와 유의하게 연관되었다고 보고한다. '깊은 연관'은 통계적 유의성과 설명량을 원문보다 강하게 해석한 표현이다.","source_evidence_quote":"In the contralateral limb, ΔvGRF (R2=0.325, P=0.001) and ΔKEM (R2=0.286, P=0.002) significantly associated with Δspeed from 6 to 12 months post-ACLR (Supplementary Table 1).","source_locator":"PAGE 8, RESULTS - Post Hoc Analysis","suggested_correction":"사후 분석에서 비수술측(대측) 무릎의 ΔvGRF(R2=0.325, P=0.001)와 ΔKEM(R2=0.286, P=0.002)가 6개월에서 12개월 사이 보행 속도 변화와 유의하게 연관되어, 종단 보행 분석에서 속도 변수를 고려할 필요가 있음을 시사했다."},{"section":"referenceable_claims","quoted_summary_text":"활용 맥락과 주의: ACLR 수술 후 잔존하는 보행 역학적 비정상성이 외상 후 퇴행성 무릎 골관절염으로 이어질 수 있는 고위험 인자임을 이론적으로 전개할 때 폭넓게 활용할 수 있다.","issue_type":"과장","severity":"경미","explanation":"원문은 보행 생체역학 변화가 PTOA 발달에 기여할 수 있다고 조심스럽게 표현한다. '고위험 인자'는 원문의 'may contribute'보다 강한 위험요인 단정에 가깝다.","source_evidence_quote":"Individuals with an anterior cruciate ligament (ACL) injury and ACL reconstruction (ACLR) often demonstrate persistent alterations in walking gait biomechanics (1–3), which may contribute to the development of post-traumatic knee osteoarthritis (PTOA) (4–6).","source_locator":"PAGE 2, INTRODUCTION","suggested_correction":"활용 맥락과 주의: ACL 손상 및 ACLR 후 지속되는 보행 역학 변화가 PTOA 발달에 기여할 수 있다는 배경 근거로 활용할 수 있다."}],"unverifiable_items":[{"quoted_summary_text":"분석 provider: antigravity","reason":"SOURCE_TEXT에는 요약 분석 provider에 관한 정보가 없으므로 원문 근거만으로는 확인할 수 없다."}]}