{"provider":"codex","title":"Wearable Devices for the Quantitative Assessment of Knee Joint Function After Anterior Cruciate Ligament Injury or Reconstruction: A Scoping Review","source_pdf":"/Users/ryutt/Desktop/mini_ryutt/Walking/docs/ref_papers/03_wearable_imu_and_portable_sensing/Wearable Devices for the Quantitative Assessment of Knee Joint Function After Anterior Cruciate Ligament Injury or Reconstruction - A Scoping Review.pdf","source_summary_path":"/Users/ryutt/Desktop/mini_ryutt/Walking/2026-06-29-Study-review/mds/papers/28_Wearable_Devices_for_the_Quantitative_Assessment_of_Knee_Joint_Function_After_Anterior_Cruciate_Ligament_Injury_or_Recon.md","sections_checked":37,"issues_found":1,"overall_verdict":"일부 수정 필요","overall_verdict_reason":"대부분의 요약 항목은 SOURCE_TEXT와 일치한다. 다만 생각해볼 내용 1개 항목에서 근거로 제시한 원문보다 TRL 7 이상이라는 구체적 단계 요구를 강하게 확장한 경미한 과장이 확인되었다. SOURCE_TEXT에서 확인할 수 없는 파일 경로 및 분석 provider 메타데이터는 별도로 unverifiable_items에 기록했다.","findings":[{"section":"reviewer_thoughts","quoted_summary_text":"성공적인 임상 전환을 위해서는 기술 연구(TRL 3-6) 수준을 넘어 임상 워크플로우에 직접 통합된 다기관 시험(TRL 7 이상)으로 연구가 확장되어야 한다. _(근거: PAGE 27, Section 5)_","issue_type":"과장","severity":"경미","explanation":"제시된 근거 문장은 더 큰 임상 연구, 워크플로우 통합, 규제 경로의 필요성을 말하지만, 요약처럼 반드시 TRL 7 이상 또는 임상 워크플로우에 직접 통합된 다기관 시험으로 확장되어야 한다고 구체적으로 단정하지는 않는다. TRL 7의 정의는 표 1에서 workflow trials/multisite pilots로 제시되지만, 해당 요약의 근거 인용문만으로는 표현이 다소 강하다.","source_evidence_quote":"Most applications\nsit at intermediate TRLs (3–6), reflecting pre-integration maturity and the need for\nlarger clinical studies, workflow integration, and regulatory pathways before clinical\nadoption.","source_locator":"PAGE 27, Section 5 Conclusions","suggested_correction":"성공적인 임상 전환을 위해서는 현재의 중간 수준 TRL(3-6)을 넘어 더 큰 규모의 임상 연구, 임상 워크플로우 통합, 규제 경로 마련이 필요하다."}],"unverifiable_items":[{"quoted_summary_text":"- 원본 파일: /Users/ryutt/Desktop/mini_ryutt/Walking/docs/ref_papers/03_wearable_imu_and_portable_sensing/Wearable Devices for the Quantitative Assessment of Knee Joint Function After Anterior Cruciate Ligament Injury or Reconstruction - A Scoping Review.pdf","reason":"SOURCE_TEXT에는 논문 PDF의 로컬 파일 경로 정보가 포함되어 있지 않아 확인할 수 없다."},{"quoted_summary_text":"- 분석 provider: antigravity","reason":"SOURCE_TEXT에는 기존 요약을 생성하거나 분석한 provider 정보가 포함되어 있지 않아 확인할 수 없다."}]}