{"provider":"codex","title":"Learning based lower limb joint kinematic estimation using open source IMU data","source_pdf":"/Users/ryutt/Desktop/mini_ryutt/Walking/docs/ref_papers/04_machine_learning_and_deep_learning/Learning based lower limb joint kinematic estimation using open source IMU data.pdf","source_summary_path":"/Users/ryutt/Desktop/mini_ryutt/Walking/2026-06-29-Study-review/mds/papers/34_Learning_based_lower_limb_joint_kinematic_estimation_using_open_source_IMU_data.md","sections_checked":41,"issues_found":3,"overall_verdict":"일부 수정 필요","overall_verdict_reason":"대부분의 핵심 요약은 원문과 일치하지만, 연구 대상 수 표현, IMU 위치 해석, 일부 기여 문장의 근거 범위에서 경미한 수정이 필요하다. 중대한 사실 왜곡은 확인되지 않았다.","findings":[{"section":"design_and_participants","quoted_summary_text":"오픈소스 데이터셋에서 건강한 성인 11명(남성 9명, 여성 2명, 데이터 손상으로 4명 제외)의 보행 데이터를 분석에 사용하였다.","issue_type":"누락","severity":"경미","explanation":"원문은 오픈소스 데이터셋이 건강한 11명으로 구성되었고, 그중 5, 9, 10, 11번 참가자는 데이터 손상으로 제외했으며, 6번 참가자는 IMU 저샘플링 데이터를 보간했다고 설명한다. 요약 문장은 11명의 데이터를 분석에 사용한 것처럼 읽힐 수 있어 실제 분석 대상이 제외 후 7명이라는 점이 불명확하다.","source_evidence_quote":"For this study, we used an open-source gait data that included IMU(MTw Awinda, Xsens North America Inc., Culver City, CA, USA) and OMC(Motion Analysis Corporation, Santa Rosa, CA, USA) from 11 healthy individuals (9 males and 2 females)27. ... We excluded data from participants 5, 9, 10, and 11 due to data corruption, including missing IMU data and synchronization issues between the IMU and OMC. For participant 6, who had a reduced sampling rate on the IMUs, we upsampled the accelerometer, gyroscope, and magnetometer data provided by the IMU using linear interpolation to match the OMC.","source_locator":"PAGE 3, Methods - Open-source data","suggested_correction":"오픈소스 데이터셋은 건강한 성인 11명(남성 9명, 여성 2명)으로 구성되었으나, 데이터 손상으로 4명(5, 9, 10, 11번)을 제외하고, 6번 참가자의 IMU 데이터는 보간하여 분석에 사용하였다."},{"section":"key_results","quoted_summary_text":"다양한 IMU 조합 중에서 대퇴골(femur)과 종골(calcaneus)에 장착된 IMU를 결합했을 때 굴곡/신전(sagittal) 엉덩관절 및 무릎관절 각도 추정에서 가장 낮은 RMSE 오차를 나타냈다.","issue_type":"누락","severity":"경미","explanation":"원문은 femur와 calcaneus를 포함한 조합이 sagittal hip 및 knee 추정에서 낮은 RMSE를 보였다고 하며, ankle 추정에서는 tibia를 포함한 조합도 강한 성능을 보였다고 덧붙인다. 요약은 hip/knee 결과 자체는 맞지만, IMU 조합 결과의 중요한 한정조건인 ankle에서 tibia의 역할을 생략해 전체 IMU 조합 결론을 다소 좁게 전달한다.","source_evidence_quote":"Across all methods, IMU combinations including femur and calcaneus showed the lowest RMSE values for sagittal hip and knee joint angle estimation. For the sagittal ankle angle estimation, IMU combinations that included the tibia also demonstrated strong performance, with average RMSE values of 2.69◦ for the UI, 8.05◦ for the UG, and 7.12◦ for the UA","source_locator":"PAGE 6, Results - IMU combinations","suggested_correction":"다양한 IMU 조합 중 femur와 calcaneus를 포함한 조합은 sagittal hip 및 knee 관절각 추정에서 가장 낮은 RMSE를 보였고, sagittal ankle 추정에서는 tibia를 포함한 조합도 강한 성능을 보였다."},{"section":"study_solution_and_contribution","quoted_summary_text":"비교 분석을 통해 하지 관절 운동학 추정을 위한 최적의 IMU 개수와 부착 위치를 제안하여 실시간 처리 및 계산량 감축을 유도하였습니다.","issue_type":"근거불충분","severity":"경미","explanation":"제시된 근거 문장은 최적 IMU 개수와 위치를 결정했다는 내용까지만 직접 지지한다. 실시간 처리 및 계산량 감축 가능성은 Discussion의 별도 문장에서 언급되므로, 현재 evidence_quote만으로는 전체 문장을 충분히 뒷받침하지 못한다.","source_evidence_quote":"Lastly, through comparative analysis, we determined the optimal number of IMUs and their locations.","source_locator":"PAGE 2, Introduction","suggested_correction":"비교 분석을 통해 하지 관절 운동학 추정을 위한 최적의 IMU 개수와 부착 위치를 제안하였다. 계산량 감축 및 실시간 적용 가능성은 Discussion에서 IMU 수 감소의 잠재적 효과로 별도 논의되었다."}],"unverifiable_items":[{"quoted_summary_text":"분석 provider: antigravity","reason":"SOURCE_TEXT는 논문 원문으로, 요약 생성 또는 분석 provider 정보를 포함하지 않아 원문에서 확인할 수 없다."}]}