{"provider":"codex","title":"Wearable IMU sensor-based motion tracking for post-stroke motor impairment assessment during activities of daily living","source_pdf":"/Users/ryutt/Desktop/mini_ryutt/Walking/docs/ref_papers/04_machine_learning_and_deep_learning/Calculate_Distance.pdf","source_summary_path":"/Users/ryutt/Desktop/mini_ryutt/Walking/2026-06-29-Study-review/mds/papers/30_Calculate_Distance.md","sections_checked":36,"issues_found":6,"overall_verdict":"신뢰 어려움","overall_verdict_reason":"대부분의 요약은 원문과 대체로 부합하지만, 개인화 모델 성능 수치, 자체 데이터셋 구축 완료 여부, 일반화 모델 대비 표현 등에서 원문과 다른 중대 오류가 확인된다.","findings":[{"section":"key_results","quoted_summary_text":"뇌졸중 환자(GG98 및 GG102)를 대상으로 한 ADL 분할 테스트에서 환자 개인 데이터를 반영하지 않은 일반화 모델(F1 0.51~0.65) 대비 개인 맞춤화 모델(individualized model)은 F1 점수 각각 0.85, 0.87로 월등한 수준을 달성함 _(근거: Page 29, Chapter 5.1)_","issue_type":"수치오류","severity":"중대","explanation":"요약은 individualized model의 F1을 GG98=0.85, GG102=0.87로 적었지만, 원문 Table 5.1에서 ADL segmentation의 individualized F1은 GG98=0.85, GG102=0.87이고, 바로 위 본문 설명은 GG98=0.87, GG102=0.88로 서술되어 서로 불일치한다. 또한 요약의 근거 원문으로 제시한 문장은 GG98=0.87, GG102=0.88이라고 되어 있어 요약 수치와 맞지 않는다.","source_evidence_quote":"For subject GG98, we reached F1 scores of 0.87 for the ADL segmentation and 0.71 for the meal segmentation task. For subject GG102, we obtained F1 scores of 0.88 for the ADL segmentation and 0.82 for the meal segmentation task.","source_locator":"--- PAGE 36 --- Chapter 5.1 Two-stage activity segmentation","suggested_correction":"뇌졸중 환자(GG98 및 GG102)를 대상으로 한 ADL 분할 테스트에서 개인 맞춤화 모델은 본문 기준 GG98 0.87, GG102 0.88의 ADL segmentation F1 점수를 보였으며, Table 5.1에는 각각 0.85와 0.87로 제시되어 있다."},{"section":"key_results","quoted_summary_text":"뇌졸중 환자(GG98 및 GG102)를 대상으로 한 ADL 분할 테스트에서 환자 개인 데이터를 반영하지 않은 일반화 모델(F1 0.51~0.65) 대비 개인 맞춤화 모델(individualized model)은 F1 점수 각각 0.85, 0.87로 월등한 수준을 달성함 _(근거: Page 29, Chapter 5.1)_","issue_type":"누락","severity":"경미","explanation":"요약은 일반화 모델 F1 0.51~0.65라고만 제시하지만, 원문 Table 5.1에는 meal segmentation generalized F1이 GG98 0.22, GG102 0.54로도 제시된다. ADL segmentation만 말하는 것이라면 이를 명시해야 한다.","source_evidence_quote":"GG98 generalized 0.42 0.51 0.22 0.22\nGG98 individualized 0.87 0.85 0.71 0.71\nGG102 generalized 0.61 0.65 0.67 0.54\nGG102 individualized 0.88 0.87 0.84 0.82","source_locator":"--- PAGE 36 --- Table 5.1","suggested_correction":"ADL segmentation 기준으로 일반화 모델의 F1은 GG98 0.51, GG102 0.65였고, 개인 맞춤화 모델의 F1은 Table 5.1 기준 GG98 0.85, GG102 0.87이었다."},{"section":"author_conclusion","quoted_summary_text":"전완 양측 2개의 IMU 센서와 CNN-BiLSTM 모델을 접목한 시공간 시점 분할 알고리즘이 건강한 대상자 및 경증 뇌졸중 환자의 일상생활 활동을 세밀한 타임스텝 수준으로 정확하게 분할해낼 수 있음을 입증함 _(근거: Page 54, Chapter 8)_","issue_type":"과장","severity":"중대","explanation":"원문 결론은 원시 IMU 데이터와 CNN-biLSTM 기반 알고리즘으로 UE ADL을 정확히 분할할 수 있음을 보였고, 두 명의 뇌졸중 환자에서 proof-of-concept를 보였다고 한다. 그러나 요약은 건강한 대상자와 경증 뇌졸중 환자 모두에서 정확한 타임스텝 분할이 입증되었다고 강하게 일반화한다. 원문은 뇌졸중 환자에 대해서는 proof-of-concept와 tailored model 필요성을 강조한다.","source_evidence_quote":"We collected data from five stroke patients and five healthy participants and used this data to demonstrate the proof-of-concept of our UE ADL segmentation algorithm on two stroke patients. Our results highlight the potential need for tailored models for post-stroke individuals due to their high motion variability.","source_locator":"--- PAGE 61 --- Chapter 8 Conclusion","suggested_correction":"전완 양측 2개의 IMU 센서와 CNN-BiLSTM 모델을 활용해 건강한 참가자 데이터에서 UE ADL의 연속 시계열 분할 성능을 보였고, 두 명의 경증 뇌졸중 환자에서는 proof-of-concept 수준으로 적용 가능성을 탐색했다."},{"section":"limitations","quoted_summary_text":"학습 및 평가에 투입한 기성 공인 데이터셋(StrokeRehab)에 원본 영상 자료가 배제되어 알고리즘 오감지의 임상적 사유 규명이나 산출된 마할라노비스 거리 척도의 실제 눈 건강성 검증이 불가능하였음 _(근거: Page 54, Chapter 8)_","issue_type":"번역오류","severity":"경미","explanation":"요약의 '실제 눈 건강성 검증'은 원문의 'appeared healthy or not'를 부자연스럽고 의미가 틀리게 옮긴 표현이다. 원문은 눈 건강성이 아니라, MHS에서 건강한 동작에 가깝다고 판단된 움직임이 실제로 건강한 움직임처럼 보이는지 확인할 수 없었다는 뜻이다.","source_evidence_quote":"Additionally, for the motion healthiness score, we could not verify whether motions that were considered close to healthy appeared healthy or not.","source_locator":"--- PAGE 61 --- Chapter 8 Conclusion","suggested_correction":"기성 오픈소스 데이터셋에 원본 영상 등 중요한 정보가 없어 오감지의 이유를 해석하기 어려웠고, MHS에서 건강한 동작에 가깝다고 평가된 움직임이 실제로 건강한 움직임처럼 보이는지도 확인할 수 없었다."},{"section":"reviewer_thoughts","quoted_summary_text":"제시된 환자 개인화 모델(individualized model)의 ADL 분할 성능(F1 0.85-0.87)은 우수하나, 학습 데이터 수집을 위해 가정 내에서 매번 환자 본인의 환측 동작에 대해 3.5시간 이상 비디오 라벨링 등의 고비용 절차가 선행되어야 하므로 자가 학습이나 준지도 전이학습 기법으로의 발전이 실제 상용화의 핵심 열쇠가 될 것이다. _(근거: Page 26, Chapter 4.2)_","issue_type":"근거불충분","severity":"중대","explanation":"원문은 한 참가자의 unstructured ADL protocol 라벨링에 약 3.5시간이 걸린다고만 말한다. 요약의 '가정 내에서 매번', '환자 본인의 환측 동작', '자가 학습이나 준지도 전이학습', '상용화의 핵심 열쇠'는 제시된 근거 문장으로 직접 지지되지 않는다.","source_evidence_quote":"Labeling the data from one participant doing the unstructured ADL protocol with the labels defined in Table 4.1 takes about 3.5 hours and results in approximately fifty segmented actions.","source_locator":"--- PAGE 33 --- Chapter 4.2 Labeling methodology","suggested_correction":"한 참가자의 unstructured ADL protocol 데이터를 Table 4.1 기준으로 라벨링하는 데 약 3.5시간이 걸려, 향후 데이터 수집·라벨링 비용을 줄이는 방법이 중요하다."},{"section":"study_solution_and_contribution","quoted_summary_text":"오픈소스 데이터셋이 결여하고 있던 비디오 및 모션 캡처 그라운드 트루스가 보장된 자가 ADL 수집용 프로토콜을 규정하고, 5명의 대조군 및 5명의 뇌졸중 환자를 통해 전구적인 신규 시계열 데이터셋 구축을 완료함 _(근거: Page 2, Abstract)_","issue_type":"과장","severity":"중대","explanation":"원문 Abstract는 주석이 달린 자연istic IMU 기반 ADL 데이터셋 수집 방법론을 제안했고, 5명 건강한 참가자와 5명 뇌졸중 참가자의 데이터를 수집했다고 한다. 그러나 원문 본문은 논문 작성 시점에 데이터셋 일부만 분석 준비가 되었고 GG98, GG102 및 일부 건강한 참가자 데이터로 proof-of-concept와 초기 테스트를 했다고 명시한다. '구축을 완료함'은 원문보다 강하다.","source_evidence_quote":"This dataset was collected close to the end of this thesis, with much time dedicated to data acquisition, labeling, syncing, and blurring the videos. As a consequence, only a portion of the dataset was prepared for analysis at the time of the writing.","source_locator":"--- PAGE 34 --- Chapter 4.3 Intermediary dataset characterization","suggested_correction":"오픈소스 데이터셋의 한계를 보완하기 위해 비디오 기반 라벨과 모션 캡처 데이터를 포함하는 자연istic ADL 수집 프로토콜을 제안하고, 5명의 건강한 참가자와 5명의 뇌졸중 참가자 데이터를 수집했으나, 논문 작성 시점에는 일부만 분석 준비가 완료되었다."}],"unverifiable_items":[{"quoted_summary_text":"- DOI: 확인 불가","reason":"SOURCE_TEXT에 DOI 유무를 확인할 수 있는 별도 메타데이터가 없으며, 원문 추출 텍스트만으로 DOI가 없다고 확정할 수 없다."},{"quoted_summary_text":"- 분석 provider: antigravity","reason":"분석 provider는 논문 원문 내용이 아니며 SOURCE_TEXT에서 확인되는 항목이 아니다."}]}