{"provider":"codex","title":"Whether Patients with Anterior Cruciate Ligament Reconstruction Walking at a Fast Speed Show more Kinematic Asymmetries?","source_pdf":"/Users/ryutt/Desktop/mini_ryutt/Walking/docs/ref_papers/01_acl_gait_biomechanics_studies/Whether Patients with Anterior Cruciate Ligament Reconstruction Walking at a Fast Speed Show more Kinematic Asymmetries.pdf","source_summary_path":"/Users/ryutt/Desktop/mini_ryutt/Walking/2026-06-29-Study-review/mds/papers/11_Whether_Patients_with_Anterior_Cruciate_Ligament_Reconstruction_Walking_at_a_Fast_Speed_Show_more_Kinematic_Asymmetries.md","sections_checked":29,"issues_found":3,"overall_verdict":"일부 수정 필요","overall_verdict_reason":"대부분의 핵심 요약은 원문과 일치하지만, 일부 표현에서 원문보다 인과성을 강하게 단정하거나 용어 번역이 부정확하며, SOURCE_TEXT에서 확인할 수 없는 메타 정보가 포함되어 있다.","findings":[{"section":"reviewer_thoughts","quoted_summary_text":"- 비정상적인 전후방 병진 운동은 무릎 연골 퇴행과 유의한 상관관계가 있으므로, 빠른 보행 시 증가된 후방 경골 병진 운동은 ACLR 환자의 관절 연골 손상을 유발할 수 있다. _(근거: PAGE 8, Discussion - Sagittal Plane)_","issue_type":"인과관계오용","severity":"경미","explanation":"원문은 후방 경골 병진 운동 증가가 관절 연골 손상을 일으킬 가능성이 있다고 조심스럽게 서술한다. 요약은 '상관관계가 있으므로 ... 유발할 수 있다'로 연결해 원문보다 인과 추론을 더 강하게 구성했다.","source_evidence_quote":"The abnormal anteroposterior translation was signiﬁcantly correlated with knee cartilage degeneration.21–24 The increased posterior tibial translation may also cause articular cartilage damage in ACLR patients.","source_locator":"PAGE 8, Discussion - Sagittal Plane","suggested_correction":"비정상적인 전후방 병진 운동은 무릎 연골 퇴행과 유의한 상관관계가 있으며, 저자들은 빠른 보행 시 증가된 후방 경골 병진 운동도 ACLR 환자의 관절 연골 손상과 관련될 가능성이 있다고 해석했다."},{"section":"referenceable_claims","quoted_summary_text":"- 한국어 번역: 수술 후 오랜 기간 동안 무릎 기능이 완전히 회복되지 않았으며, 이는 비정상적인 무릎 외굴곡 모멘트 및 무릎 내전 모멘트로 나타났다.","issue_type":"번역오류","severity":"경미","explanation":"'knee external ﬂexion moments'를 '무릎 외굴곡 모멘트'로 옮긴 것은 부정확하다. 원문 표현은 비정상적인 무릎 외부 굴곡 모멘트와 무릎 내전 모멘트를 말한다.","source_evidence_quote":"In a long period after surgery, the knee function was not fully recovered, which was manifested as abnormal knee external ﬂexion moments and knee adduction moments.5","source_locator":"PAGE 2, Introduction","suggested_correction":"수술 후 장기간에도 무릎 기능은 완전히 회복되지 않았으며, 이는 비정상적인 무릎 외부 굴곡 모멘트와 무릎 내전 모멘트로 나타났다."},{"section":"referenceable_claims","quoted_summary_text":"- 활용 맥락과 주의: ACLR 수술 후 장기적인 역학적 비대칭 및 모멘트 변화를 기술할 때 유용하며, 원저자인 Kaur 등(2016) 연구를 참조해야 함.","issue_type":"과장","severity":"경미","explanation":"해당 원문 문장은 장기간 후 무릎 기능 미회복과 비정상 모멘트를 말하지만, '역학적 비대칭'이라는 표현은 이 인용문 자체에서 직접 확인되지 않는다.","source_evidence_quote":"In a long period after surgery, the knee function was not fully recovered, which was manifested as abnormal knee external ﬂexion moments and knee adduction moments.5","source_locator":"PAGE 2, Introduction","suggested_correction":"ACLR 수술 후 장기적으로 무릎 기능 미회복과 비정상적인 무릎 모멘트가 보고되었다는 배경 근거로 사용할 수 있으며, 원저자인 Kaur 등(2016) 연구를 참조해야 함."}],"unverifiable_items":[{"quoted_summary_text":"- 원본 파일: /Users/ryutt/Desktop/mini_ryutt/Walking/docs/ref_papers/01_acl_gait_biomechanics_studies/Whether Patients with Anterior Cruciate Ligament Reconstruction Walking at a Fast Speed Show more Kinematic Asymmetries.pdf","reason":"SOURCE_TEXT에는 로컬 파일 경로 정보가 포함되어 있지 않아 확인할 수 없다."},{"quoted_summary_text":"- 분석 provider: antigravity","reason":"SOURCE_TEXT에는 요약 생성 또는 분석 provider 정보가 포함되어 있지 않아 확인할 수 없다."}]}