{"provider":"codex","title":"Clinically relevant predictive modeling for personalized ACL reconstruction classification","source_pdf":"/Users/ryutt/Desktop/mini_ryutt/Walking/docs/ref_papers/04_machine_learning_and_deep_learning/Clinically relevant predictive modeling for personalized_ACL_reconstruction_classification.pdf","source_summary_path":"/Users/ryutt/Desktop/mini_ryutt/Walking/2026-06-29-Study-review/mds/papers/31_Clinically_relevant_predictive_modeling_for_personalized_ACL_reconstruction_classification.md","sections_checked":28,"issues_found":6,"overall_verdict":"신뢰 어려움","overall_verdict_reason":"대부분의 방법·결과 요약은 원문과 대체로 일치하지만, 일부 항목에서 원문에 없는 인과 설명과 강한 임상적 해석이 추가되었고, 연구 대상 및 방법론 설명에서 핵심 사실을 다르게 쓴 중대 오류가 확인되었다.","findings":[{"section":"design_and_participants","quoted_summary_text":"연구에는 74명의 ACL 재건 수술을 받은 환자(왼쪽 무릎 부상 31명, 오른쪽 무릎 부상 43명)와 5명의 건강한 대조군을 포함하여 총 79명의 참가자가 모집되었다. _(근거: PAGE 2, 3. Methodology)_","issue_type":"사실불일치","severity":"경미","explanation":"원문은 방법론에서 참가자를 'ACL patients'라고 표현하며, 이 문장 자체에서는 모두가 ACL 재건 수술을 받은 환자라고 명시하지 않는다. 논문 제목과 전체 맥락은 ACL reconstruction classification이지만, 해당 근거 문장만으로 '재건 수술을 받은 환자'라고 단정하는 것은 원문 표현보다 구체적이다.","source_evidence_quote":"We recruited 79 participants, including 74 ACL patients (31 with left knee injuries, 43 with right knee injuries) and 5 healthy individuals.","source_locator":"PAGE 2, 3. Methodology","suggested_correction":"연구에는 74명의 ACL 환자(왼쪽 무릎 부상 31명, 오른쪽 무릎 부상 43명)와 5명의 건강한 개인을 포함하여 총 79명의 참가자가 모집되었다."},{"section":"methods","quoted_summary_text":"데이터를 64Hz로 다운샘플링하고 10초의 비중첩 창으로 분할한 후, 센서 판독치 간의 복잡한 상호작용을 포착하기 위해 각 주파수 대역에서 위상 경사 지수(PSI)를 계산하여 쌍별 인과 관계 특성 행렬(총 435개의 고유 특징)을 생성하였다. _(근거: PAGE 2, 3. Methodology)_","issue_type":"누락","severity":"경미","explanation":"요약은 PSI 계산 전 전처리의 일부인 센서 간 동기화와 walking/jogging 구간을 신호 패턴 변화의 시각적 검사로 분리했다는 절차를 생략했다. 핵심 결론을 뒤집지는 않지만, 방법 절차의 중요한 선행 단계가 빠졌다.","source_evidence_quote":"For preprocessing, we first synchronized data across sensors and separated walking and jogging sequences through visual inspection of signal pattern changes. We then downsampled the data from 128 Hz to 64 Hz and segmented it into non-overlapping 10-second windows","source_locator":"PAGE 2, 3. Methodology","suggested_correction":"전처리에서는 먼저 센서 간 데이터를 동기화하고 신호 패턴 변화의 시각적 검사를 통해 걷기와 조깅 구간을 분리한 뒤, 데이터를 128Hz에서 64Hz로 다운샘플링하고 10초 비중첩 창으로 분할하였다. 이후 PSI를 계산하여 총 435개의 고유 쌍별 인과 관계 특징을 구성하였다."},{"section":"reviewer_thoughts","quoted_summary_text":"조깅 데이터 분석이 보행 분석보다 클래스 분리도와 분류 성능 면에서 더 우수한 결과를 보인 것은, 달리기와 같이 부하가 높고 고속인 운동에서 하지 및 상지 간 협응의 미세한 기능적 불균형이나 이상 징후가 더 쉽게 드러나고 모델에 유용한 식별 신호를 제공함을 보여준다. _(근거: PAGE 4, 4.3. Dimension reduction examination)_","issue_type":"근거불충분","severity":"중대","explanation":"원문은 조깅 플롯이 더 분리되어 있고 전역 데이터 구조를 더 잘 포착한다고 해석하지만, '부하가 높고 고속인 운동에서 하지 및 상지 간 협응의 미세한 기능적 불균형이나 이상 징후가 더 쉽게 드러난다'는 생체역학적 원인 설명은 제시하지 않는다.","source_evidence_quote":"Notably, jogging phase plots showed more distinctly separated clusters with reduced class overlap compared to walking, suggesting that jogging captures better global data structure. This improved cluster separation aligns with the superior model performance in jogging conditions relative to walking.","source_locator":"PAGE 4, 4.3. Dimension reduction examination","suggested_correction":"조깅 데이터는 보행 데이터보다 t-SNE에서 클래스 겹침이 적고 군집이 더 뚜렷했으며, 이는 조깅 조건에서 전역 데이터 구조가 더 잘 포착되고 분류 성능도 더 높았다는 원문 결과와 일치한다."},{"section":"reviewer_thoughts","quoted_summary_text":"기계학습 모델의 신뢰도가 환자의 회복 기간이 지남에 따라 감소하는 특이한 상관관계는, 재활이 성공하여 보행 패턴이 완전히 정상화될수록 정상군과의 보행 특징 차이가 사라지기 때문에 생기는 현상이며, 이를 역으로 이용해 모델 신뢰도 지표를 보행 패턴 회복의 성숙도 및 정상화의 객관적인 간접 척도로 활용할 수 있음을 나타낸다. _(근거: PAGE 5, 4.4. Patient-specific factor analysis)_","issue_type":"과장","severity":"경미","explanation":"원문은 회복이 진행될수록 움직임 패턴이 점진적으로 정상화되고 모델이 회복 timeline 추적에 잠재적으로 쓰일 수 있다고 말한다. 요약의 '완전히 정상화', '차이가 사라진다', '성숙도 및 정상화의 객관적인 간접 척도'는 원문보다 강한 표현이다.","source_evidence_quote":"This trend supports the clinical understanding that as recovery progresses, movement patterns gradually normalize, becoming more similar to uninjured gait. The correlation between recovery duration and classification confidence provides quantitative evidence for rehabilitation progress, indicating that our model could potentially serve as an objective tool for tracking recovery timeline and informing return-to-sport decisions based on movement pattern normalization.","source_locator":"PAGE 5, 4.4. Patient-specific factor analysis","suggested_correction":"회복 기간이 길수록 모델이 높은 신뢰도로 분류하기 어려운 경향은 회복이 진행되면서 움직임 패턴이 점진적으로 정상 보행에 더 가까워진다는 해석을 뒷받침하며, 모델 신뢰도는 회복 timeline 추적과 복귀 결정에 활용될 수 있는 잠재적 객관 지표로 제시되었다."},{"section":"study_solution_and_contribution","quoted_summary_text":"본 연구는 관성 측정 센서(IMU) 데이터와 환자의 고유한 임상적 특성을 위상 경사 지수(PSI) 및 차원 축소 기법을 통해 통합 분석함으로써, 기계학습 모델의 높은 분류 성능과 임상적 해석력을 동시에 확보하는 방법론을 제안하였다. _(근거: PAGE 2, 1. Introduction)_","issue_type":"사실불일치","severity":"중대","explanation":"원문은 IMU 기반 보행 분석과 환자별 특성을 통합하는 접근을 제안했지만, 방법론상 PSI는 보행 동역학 특징 계산에 사용되고 t-SNE 차원 축소는 feature matrix와 confidence 분포 시각화에 사용되었다. 환자 고유 특성을 PSI 및 차원 축소 기법으로 '통합 분석'했다고 쓰면 방법의 구조를 다르게 설명한다.","source_evidence_quote":"To address these limitations, we propose a novel approach integrating multi-modal gait analysis using IMU sensors with patient-specific characteristics.","source_locator":"PAGE 2, 1. Introduction","suggested_correction":"본 연구는 IMU 센서를 이용한 다중 모달 보행 분석과 환자별 특성을 함께 고려하는 접근을 제안했으며, PSI 기반 특징으로 분류 모델을 학습하고 t-SNE 및 모델 신뢰도 분석으로 환자별 회복 양상을 해석하였다."},{"section":"referenceable_claims","quoted_summary_text":"활용 맥락과 주의: 이 논문의 직접적인 정량 결과로, 위상 경사 지수(PSI) 특징과 16Hz 대역의 통계적 필터링을 통해 KNN 모델이 높은 수준으로 환자의 재건 상태를 탐지해 낼 수 있음을 나타낼 때 사용함.","issue_type":"번역오류","severity":"경미","explanation":"원문은 '16 Hz filtered data' 또는 frequency range/threshold라고 표현한다. 이를 '통계적 필터링'이라고 부르는 근거는 없으며, 통계적 필터링이라는 방법이 설명되어 있지 않다.","source_evidence_quote":"For healthy-injured classification, KNN’s performance was even more impressive, achieving approximately 98% accuracy for walking and 99% for jogging, both with the 16 Hz filtered data.","source_locator":"PAGE 3, 4.1. Predictive modeling evaluation","suggested_correction":"활용 맥락과 주의: 이 논문의 직접적인 정량 결과로, PSI 특징과 16Hz로 필터링된 데이터를 사용했을 때 KNN 모델이 건강군/부상군 분류에서 높은 정확도를 보였음을 나타낼 때 사용할 수 있음."}],"unverifiable_items":[{"quoted_summary_text":"분석 provider: antigravity","reason":"SOURCE_TEXT에는 요약 작성 또는 분석 provider에 관한 정보가 없다."}]}