{"provider":"codex","title":"Learning based lower limb joint kinematic estimation using open source IMU data","source_pdf":"/Users/ryutt/Desktop/mini_ryutt/Walking/docs/ref_papers/04_machine_learning_and_deep_learning/Learning based lower limb joint kinematic estimation using open source IMU data.pdf","source_summary_path":"/Users/ryutt/Desktop/mini_ryutt/Walking/2026-06-29-Study-review/mds/papers/34_Learning_based_lower_limb_joint_kinematic_estimation_using_open_source_IMU_data.md","sections_checked":41,"issues_found":1,"overall_verdict":"일부 수정 필요","overall_verdict_reason":"대부분의 요약은 SOURCE_TEXT와 일치하지만, IMU 위치 기여 항목에서 제시된 근거 인용문이 계산량 감축 및 실시간 처리 가능성까지 직접 지지하지 못하는 경미한 근거 문제가 있다.","findings":[{"section":"study_solution_and_contribution","quoted_summary_text":"비교 분석을 통해 하지 관절 운동학 추정을 위한 최적의 IMU 개수와 부착 위치를 제안하여 실시간 처리 및 계산량 감축을 유도하였습니다. _(근거: PAGE 2, Introduction)_","issue_type":"근거불충분","severity":"경미","explanation":"요약의 앞부분인 최적 IMU 개수와 위치를 결정했다는 내용은 제시된 PAGE 2 인용문으로 지지된다. 그러나 같은 bullet의 ‘실시간 처리 및 계산량 감축’은 제시된 인용문에는 없고, PAGE 9 Discussion의 별도 문장에 근거해야 한다.","source_evidence_quote":"Lastly, through comparative analysis, we determined the optimal number of IMUs and their locations.","source_locator":"PAGE 2, Introduction","suggested_correction":"비교 분석을 통해 하지 관절 운동학 추정을 위한 최적의 IMU 개수와 부착 위치를 제시하였다."}],"unverifiable_items":[{"quoted_summary_text":"분석 provider: antigravity","reason":"SOURCE_TEXT에는 요약 생성 provider 또는 분석 provider에 관한 정보가 없어 원문 근거로 확인할 수 없다."}]}