{"provider":"codex","title":"Longitudinal changes in knee gait mechanics between 2 and 8 years after anterior cruciate ligament reconstruction","source_pdf":"/Users/ryutt/Desktop/mini_ryutt/Walking/docs/ref_papers/01_acl_gait_biomechanics_studies/Longitudinal changes in knee gait mechanics between_2_and_8_years_after_anterior_cruciate_ligament_reconstruction.pdf","source_summary_path":"/Users/ryutt/Desktop/mini_ryutt/Walking/2026-06-29-Study-review/mds/papers/08_Longitudinal_changes_in_knee_gait_mechanics_between_2_and_8_years_after_anterior_cruciate_ligament_reconstruction.md","sections_checked":37,"issues_found":1,"overall_verdict":"일부 수정 필요","overall_verdict_reason":"대부분의 요약은 원문과 일치하지만, 건강한 대조군과의 비교 결과를 운동학 결과로 한정하지 않아 운동역학 비교 결과와 충돌하는 경미한 누락이 있다.","findings":[{"section":"key_results","quoted_summary_text":"건강한 대조군 모집단과의 비교에서는 단 하나의 유의미한 차이만 나타났는데, 8년 추적 관찰 시 입각기 후반부의 최소 무릎 굴곡 각도 시점에서 ACLR 사지가 대조군에 비해 더 굴곡되어 있었다(p=0.021). _(근거: PAGE 6, RESULTS)_","issue_type":"누락","severity":"경미","explanation":"요약 문장은 건강한 대조군과의 전체 비교에서 유의미한 차이가 하나뿐이었다고 읽히지만, 원문 PAGE 6의 해당 문장은 운동학 비교에 한정된다. 운동역학 결과에서는 baseline 및 follow-up에서 대조군과의 유의한 차이가 여러 개 보고되어 있어, '운동학 비교에서'라는 한정이 필요하다.","source_evidence_quote":"Comparison to the healthy control population at baseline demonstrated that the KEM1 was significantly higher in the ACLR (p=0.012) and contralateral (p=0.047) limbs versus control. Further, at baseline the KERM was significantly reduced in the ACLR (p=0.041) limb versus control and the peak KFM was significantly reduced in both the ACLR (p=0.006) and contralateral (p=0.048) limbs versus control. At follow-up, KEM2 was significantly reduced in the ACLR (p=0.011) limb versus control.","source_locator":"PAGE 5-6, RESULTS, Kinetics","suggested_correction":"건강한 대조군과의 운동학 비교에서는 단 하나의 유의미한 차이만 나타났는데, 8년 추적 관찰 시 입각기 후반부의 최소 무릎 굴곡 각도 시점에서 ACLR 사지가 대조군에 비해 더 굴곡되어 있었다(p=0.021)."}],"unverifiable_items":[{"quoted_summary_text":"- 원본 파일: /Users/ryutt/Desktop/mini_ryutt/Walking/docs/ref_papers/01_acl_gait_biomechanics_studies/Longitudinal changes in knee gait mechanics between 2 and 8 years after anterior cruciate ligament reconstruction.pdf","reason":"SOURCE_TEXT에는 로컬 파일 경로 정보가 포함되어 있지 않아 원문만으로 확인할 수 없다."},{"quoted_summary_text":"- 분석 provider: antigravity","reason":"SOURCE_TEXT에는 요약 생성 또는 분석 provider 정보가 포함되어 있지 않아 원문만으로 확인할 수 없다."}]}