{"provider":"codex","title":"Optimizing wearable IMU configurations for running gait analysis: a machine learning-based sensor fusion approach","source_pdf":"/Users/ryutt/Desktop/mini_ryutt/Walking/docs/ref_papers/04_machine_learning_and_deep_learning/Optimizing wearable IMU configurations for running gait analysis - a machine learning-based sensor fusion approach.pdf","source_summary_path":"/Users/ryutt/Desktop/mini_ryutt/Walking/2026-06-29-Study-review/mds/papers/38_Optimizing_wearable_IMU_configurations_for_running_gait_analysis_a_machine_learning_based_sensor_fusion_approach.md","sections_checked":33,"issues_found":3,"overall_verdict":"신뢰 어려움","overall_verdict_reason":"대부분의 요약은 원문과 일치하지만, 선행문헌 매핑에서 중대한 누락이 있고, 일부 해석 문장이 원문보다 강하게 표현되었거나 원문이 직접 말하지 않는 내용을 포함한다.","findings":[{"section":"referenceable_claims","quoted_summary_text":"- 해당 선행문헌: Hreljac, A. (2004). Impact and overuse injuries in runners. Med. and Sci. Sports and\nExerc. 36 (5), 845–849. doi:10.1249/01.mss.0000126803.66636.dd","issue_type":"인용표기오류","severity":"중대","explanation":"요약의 원문 내 인용표기는 Hreljac 2004와 Davis and Powers 2010 두 문헌인데, 해당 선행문헌에는 Hreljac 2004만 제시되어 Davis and Powers 2010이 누락되었다.","source_evidence_quote":"For instance, excessive vertical impact forces, high vertical\noscillation (VO), prolonged ground contact time (GCT), and\nexcessive pronation are considered key risk factors (Hreljac,\n2004; Davis and Powers, 2010).","source_locator":"PAGE 2, 1 Introduction","suggested_correction":"해당 선행문헌은 Hreljac (2004)와 Davis and Powers (2010)를 모두 포함해야 한다."},{"section":"reviewer_thoughts","quoted_summary_text":"- 단일 센서 구성은 보행 비대칭성 감지에 치명적인 한계가 있어 임상적으로 유용한 비대칭성 평가를 위해서는 3-센서 구성이 필수적이다. _(근거: PAGE 1, Results)_","issue_type":"과장","severity":"경미","explanation":"원문은 단일 센서가 gait asymmetry를 감지하지 못했고 3센서 구성이 이를 해결했다고 설명하지만, '치명적인 한계'나 '임상적으로 유용한 평가를 위해 필수적'이라는 표현은 원문보다 강한 단정이다.","source_evidence_quote":"However, this single-node setup failed to detect gait\nasymmetry (R2\n� 0.52). A distributed three-sensor fusion configuration\n(Lumbosacral + Bilateral Ankles) resolved this limitation, achieving results\ncomparable to the full-body system for all parameters","source_locator":"PAGE 1, Results","suggested_correction":"단일 센서 구성은 보행 비대칭성 감지에 한계가 있었고, 요추와 양측 발목을 결합한 3-센서 구성이 이 한계를 해결했다."},{"section":"study_solution_and_contribution","quoted_summary_text":"- 머신러닝을 활용하여 신체의 중요 노드(질량 중심 및 말단 효과기)에서 수집한 데이터의 정보 중복성을 디코딩함으로써 부족한 하드웨어를 가상화하는 방법을 제안한다. _(근거: PAGE 2, 1 Introduction)_","issue_type":"근거불충분","severity":"경미","explanation":"제시된 근거 원문은 정보 중복성과 중요 노드의 잠재 특징이 핵심 시공간 보행 스칼라를 추정하기에 충분하다는 가설을 말하지만, '디코딩' 및 '부족한 하드웨어를 가상화'한다는 부분은 이어지는 문장에서 확인된다. 현재 evidence_quote만으로는 요약 문장 전체를 충분히 지지하지 못한다.","source_evidence_quote":"By training supervised regression models to learn\nthe non-linear mapping between these minimal inputs and full-\nsystem outputs, we can effectively “virtualize” the missing\nsensors.","source_locator":"PAGE 2, 1 Introduction","suggested_correction":"머신러닝을 활용해 질량 중심 및 말단 효과기 등 중요 노드에서 얻은 최소 입력과 전신 시스템 출력 간의 비선형 매핑을 학습함으로써 누락된 센서를 효과적으로 '가상화'하는 접근을 제안한다."}],"unverifiable_items":[{"quoted_summary_text":"- 분석 provider: antigravity","reason":"SOURCE_TEXT에는 분석 provider에 관한 정보가 없어 원문 근거로 확인할 수 없다."}]}