{"provider":"codex","title":"Laboratory Environments Mask Gait Differences Between Healthy Participants and Patients With Anterior Cruciate Ligament Reconstruction","source_pdf":"/Users/ryutt/Desktop/mini_ryutt/Walking/docs/ref_papers/03_wearable_imu_and_portable_sensing/Laboratory Environments Mask Gait Differences Between Healthy Participants and Patients With Anterior Cruciate Ligament Reconstruction.pdf","source_summary_path":"/Users/ryutt/Desktop/mini_ryutt/Walking/2026-06-29-Study-review/mds/papers/24_Laboratory_Environments_Mask_Gait_Differences_Between_Healthy_Participants_and_Patients_With_Anterior_Cruciate_Ligament_.md","sections_checked":39,"issues_found":4,"overall_verdict":"일부 수정 필요","overall_verdict_reason":"대부분의 핵심 요약은 원문과 일치하지만, 방법 섹션의 번역 오류, 분석 provider 표기 불일치, 일부 해석 문장의 과장 및 수치 결과 성격 설명 오류가 있어 부분 수정이 필요하다. 중대 등급의 사실 왜곡은 확인되지 않았다.","findings":[{"section":"bibliographic_info","quoted_summary_text":"- 분석 provider: antigravity","issue_type":"사실불일치","severity":"경미","explanation":"사용자 요청에서 반환 provider는 `codex`로 지정되어 있으나 기존 요약의 서지정보에는 `antigravity`로 표기되어 있다. 이는 논문 원문 내용은 아니지만, 검증 대상 요약의 메타데이터가 요청 조건과 맞지 않는다.","source_evidence_quote":"- provider: `codex`","source_locator":"사용자 요청 템플릿","suggested_correction":"- 분석 provider: codex"},{"section":"methods","quoted_summary_text":"- 자이로스코프의 각속도는 차단 주파수 0.25 Hz의 고통과 필터와 35 Hz의 저통과 필터로 필터링되었다. _(근거: PAGE 3, II. METHODS)_","issue_type":"번역오류","severity":"경미","explanation":"원문의 `high-pass filter`는 고역통과 필터를 뜻하지만, 요약에는 `고통과 필터`로 잘못 표기되어 있다. 수치와 저역통과 필터 부분은 원문과 일치한다.","source_evidence_quote":"Angular velocities from the gyroscopes were filtered with a high-pass filter with a cutoff frequency of 0.25 Hz, followed by a low-pass filter with a cut-off frequency of 35 Hz.","source_locator":"PAGE 3, II. METHODS","suggested_correction":"자이로스코프의 각속도는 차단 주파수 0.25 Hz의 고역통과 필터와 35 Hz의 저역통과 필터로 필터링되었다."},{"section":"reviewer_thoughts","quoted_summary_text":"- 일상생활에서의 다양한 지형 조건이나 주의 분산 요소가 오히려 수술 후 환자의 보상적 보행 전략을 관찰하는 데 필수적인 자극이 될 수 있음을 의미한다. _(근거: PAGE 7, IV. DISCUSSION)_","issue_type":"과장","severity":"경미","explanation":"원문은 실험실의 방해 없는 환경이 보상적 보행 전략을 가릴 수 있고, 일상생활의 지형은 통제되지 않은 한계라고 설명한다. 그러나 요약처럼 다양한 지형 조건이나 주의 분산 요소가 `필수적인 자극`이라고 단정하지는 않는다.","source_evidence_quote":"A third limitation is the variable terrain in daily life compared to the laboratory. While we cannot conclude with certainty the reason behind the differences between the laboratory and daily life outcomes, it suffices to know that the laboratory is not a realistic representation of natural environment gait.","source_locator":"PAGE 6-7, IV. DISCUSSION","suggested_correction":"일상생활의 다양한 지형과 주의 분산 요소는 실험실 보행이 자연 환경 보행을 충분히 대표하지 못할 수 있음을 해석할 때 고려해야 할 요인이다."},{"section":"referenceable_claims","quoted_summary_text":"- 활용 맥락과 주의: ACLR 수술 후 환자들이 일상생활에서 실험실 검사 시보다 더 조심스럽거나 보수적인 보행 패턴(긴 보행 주기, 긴 이중 지지 시간)을 채택함을 나타내는 핵심 정량 결과로 직접 인용할 수 있다.","issue_type":"근거불충분","severity":"경미","explanation":"원문 발췌는 ACLR 환자가 실험실보다 일상생활에서 보행 주기와 이중 지지 시간이 길었다는 결과를 말하지만, 해당 문장 자체에는 수치가 포함되어 있지 않다. 또한 `더 조심스럽거나 보수적인 보행 패턴`이라는 해석은 가능한 설명일 수 있으나 원문 발췌만으로 직접 확인되는 표현은 아니다.","source_evidence_quote":"We found that patients following ACLR walk with longer gait-cycle times and rely more on double support in daily life compared to the laboratory.","source_locator":"PAGE 6, IV. DISCUSSION","suggested_correction":"활용 맥락과 주의: ACLR 수술 후 환자들이 실험실보다 일상생활에서 더 긴 보행 주기 시간과 더 큰 이중 지지 의존도를 보였다는 결과로 직접 인용할 수 있다."}],"unverifiable_items":[]}