{"provider":"codex","title":"Angular Velocities and Linear Accelerations Derived from Inertial Measurement Units Can Be Used as Proxy Measures of Knee Variables Associated with ACL Injury","source_pdf":"/Users/ryutt/Desktop/mini_ryutt/Walking/docs/ref_papers/03_wearable_imu_and_portable_sensing/Angular Velocities and Linear Accelerations Derived from Inertial Measurement Units Can Be Used as Proxy Measures of Knee Variables Associated with ACL Injury.pdf","source_summary_path":"/Users/ryutt/Desktop/mini_ryutt/Walking/2026-06-29-Study-review/mds/papers/20_Angular_Velocities_and_Linear_Accelerations_Derived_from_Inertial_Measurement_Units_Can_Be_Used_as_Proxy_Measures_of_Kne.md","sections_checked":46,"issues_found":5,"overall_verdict":"신뢰 어려움","overall_verdict_reason":"대부분의 요약은 원문과 잘 부합하지만, 일부 기여 및 레퍼런스 문장에서 원문의 신중한 표현을 '증명', '유효', '강력하게 대변'처럼 확정적으로 과장한 중대 문제가 있다.","findings":[{"section":"study_solution_and_contribution","quoted_summary_text":"이 연구는 ACL 부상 위험 모니터링 평가 동작 중 무릎 관절 변수를 추정하기 위해 IMU에서 유도된 각속도 및 가속도를 대리 지표로 사용할 수 있는 가능성을 증명했다. _(근거: PAGE 11, Section 5. Conclusions)_","issue_type":"과장","severity":"중대","explanation":"원문은 IMU 유도 지표를 대리 지표로 사용하는 것이 '가능할 수 있음'을 시사한다고 표현한다. 요약의 '증명했다'는 탐색적 상관연구의 결론을 확정적 검증처럼 강화한다.","source_evidence_quote":"The findings from this study suggest that it may be feasible to use IMU-derived angular velocities and accelerations as proxy measures of knee variables in movements included in practitioner assessments used to monitor ACL injury risk.","source_locator":"PAGE 11, Section 5. Conclusions","suggested_correction":"이 연구는 ACL 부상 위험 모니터링 평가 동작 중 무릎 관절 변수를 추정하기 위해 IMU에서 유도된 각속도 및 가속도를 대리 지표로 사용할 수 있을 가능성을 시사했다."},{"section":"study_solution_and_contribution","quoted_summary_text":"3축 IMU의 모든 축을 결합하여 결과 각속도 및 가속도를 계산하는 방식을 적용해, 센서의 부착 정렬에 구애받지 않고 실무에서 편리하게 활용할 수 있어 필드 평가의 반복재현성을 높였다. _(근거: PAGE 11, Section 4. Discussion)_","issue_type":"과장","severity":"경미","explanation":"원문은 방향을 특정 축에 맞출 필요가 없어 현장 반복성을 개선하는 데 유익할 것이라고 설명한다. 실제로 반복재현성이 향상되었음을 실험적으로 입증했다는 표현은 원문보다 강하다.","source_evidence_quote":"As a result, combining all axes from a triaxial IMU to calculate resultant angular velocities and accelerations, as used in this study, would be beneficial since the orientation of the IMU does not have to be aligned to a specific axis, thus improving the repeatability of using an IMU in the field [45].","source_locator":"PAGE 11, Section 4. Discussion","suggested_correction":"3축 IMU의 모든 축을 결합하여 결과 각속도 및 가속도를 계산하는 방식은 센서 방향을 특정 축에 맞출 필요를 줄여, 현장 IMU 사용의 반복성을 개선하는 데 유익할 수 있다."},{"section":"reviewer_thoughts","quoted_summary_text":"본 연구에서 건강한 성인만을 대상으로 제한한 것은 타당한 통제 연구이나, 실제 임상 현장이나 스포츠 현장에서 재활 상태를 모니터링하기 위해서는 ACL 재건 환자를 대상으로 한 후속 타당성 연구가 필수적이다. _(근거: PAGE 11, Section 4. Discussion)_","issue_type":"과장","severity":"경미","explanation":"원문은 ACL 재건 환자와 비손상 대조군 비교 연구가 가능하다고 제안하지만, '필수적'이라고 단정하지는 않는다.","source_evidence_quote":"future research could compare patients who have had an ACL reconstruction to non-injured controls to investigate the feasibility of using IMUs on ACL reconstructed individuals.","source_locator":"PAGE 11, Section 4. Discussion","suggested_correction":"본 연구는 건강한 참가자만을 대상으로 했으므로, 실제 재활·스포츠 현장 적용 가능성을 평가하려면 ACL 재건 환자와 비손상 대조군을 비교하는 후속 연구가 필요하다."},{"section":"referenceable_claims","quoted_summary_text":"활용 맥락과 주의: 이 연구의 자체 발견 사실로, 양측 및 단측 드롭 점프와 90도 커팅 동작 전체에서 경골 부착 IMU의 결과 각속도 적분값(곡선 아래 면적)이 무릎 관절 가동 범위(RoM)의 대리 지표로 유효함을 보여준다.","issue_type":"과장","severity":"중대","explanation":"원문은 강한 양의 상관관계와 대리 지표로 사용될 수 있음을 제시하지만, '유효함을 보여준다'는 표현은 타당도 검증이 완료된 것처럼 확정적이다.","source_evidence_quote":"Specifically, the area under the tibia angular velocity curve may be used as a proxy measure for knee RoM in the bilateral and unilateral drop jumps, and the cut.","source_locator":"PAGE 12, Section 5. Conclusions","suggested_correction":"활용 맥락과 주의: 이 연구의 자체 발견 사실로, 양측 및 단측 드롭 점프와 90도 커팅 동작에서 경골 부착 IMU의 결과 각속도 곡선 아래 면적이 무릎 RoM의 대리 지표로 사용될 수 있음을 시사한다."},{"section":"referenceable_claims","quoted_summary_text":"활용 맥락과 주의: 이 연구의 자체 발견 사실로, 단측 드롭 점프 동작 시 경골 가속도 적분값이 무릎 RoM, 모멘트 변화량, 관절 강성을 모두 강력하게 대변할 수 있음을 나타낸다. 단, 단측 동작에만 국한하여 강한 상관관계를 보였음에 유의해야 한다.","issue_type":"과장","severity":"중대","explanation":"원문은 단측 드롭 점프에서 강한 상관관계를 보였고 유용한 대리 지표일 수 있다고 말한다. '강력하게 대변할 수 있음'은 상관관계를 대리 측정의 확정적 성능으로 과도하게 해석한다.","source_evidence_quote":"The area under the tibia acceleration curve may be a useful proxy measure for practitioners wanting to detect differences in knee joint stiffness, change in knee moment, and knee RoM in an applied setting, but only in a unilateral drop jump.","source_locator":"PAGE 12, Section 5. Conclusions","suggested_correction":"활용 맥락과 주의: 이 연구의 자체 발견 사실로, 단측 드롭 점프 동작에서 경골 가속도 곡선 아래 면적은 무릎 RoM, 모멘트 변화량, 관절 강성의 차이를 감지하는 데 유용한 대리 지표일 수 있다. 이 해석은 단측 드롭 점프에 한정된다."}],"unverifiable_items":[{"quoted_summary_text":"원본 파일: /Users/ryutt/Desktop/mini_ryutt/Walking/docs/ref_papers/03_wearable_imu_and_portable_sensing/Angular Velocities and Linear Accelerations Derived from Inertial Measurement Units Can Be Used as Proxy Measures of Knee Variables Associated with ACL Injury.pdf","reason":"SOURCE_TEXT에는 로컬 파일 경로 정보가 포함되어 있지 않아 원문만으로 확인할 수 없다."},{"quoted_summary_text":"분석 provider: antigravity","reason":"SOURCE_TEXT에는 요약 생성 또는 분석 provider 정보가 포함되어 있지 않아 원문만으로 확인할 수 없다."}]}