{"provider":"codex","title":"Estimation of Kinetics Using IMUs to Monitor and Aid in Clinical Decision-Making during ACL Rehabilitation: A Systematic Review","source_pdf":"/Users/ryutt/Desktop/mini_ryutt/Walking/docs/ref_papers/03_wearable_imu_and_portable_sensing/Estimation of Kinetics Using IMUs to Monitor and Aid in Clinical Decision-Making during ACL Rehabilitation - A Systematic Review.pdf","source_summary_path":"/Users/ryutt/Desktop/mini_ryutt/Walking/2026-06-29-Study-review/mds/papers/21_Estimation_of_Kinetics_Using_IMUs_to_Monitor_and_Aid_in_Clinical_Decision_Making_during_ACL_Rehabilitation_A_Systematic_.md","sections_checked":47,"issues_found":2,"overall_verdict":"일부 수정 필요","overall_verdict_reason":"대부분의 요약은 원문과 일치하지만, 일부 표현이 원문보다 강하게 번역되었고, 분석 provider 항목은 제공된 원문에서 확인할 수 없다.","findings":[{"section":"referenceable_claims","quoted_summary_text":"한국어 번역: 여성 집단이 전방십자인대(ACL) 부상 위험에 노출될 확률이 훨씬 높다는 점 또한 중요하게 인지되어야 한다.","issue_type":"과장","severity":"경미","explanation":"원문은 여성 집단의 ACL injury risk가 증가되어 있다고만 표현한다. 요약 번역의 '훨씬 높다'는 원문보다 강한 정도 표현이다.","source_evidence_quote":"It is also important to note that the female population has an increased risk of ACL injury [100].","source_locator":"PAGE 16, 4.4. Applicability for ACL Rehabilitation","suggested_correction":"한국어 번역: 여성 집단은 ACL 손상 위험이 증가되어 있다는 점 또한 중요하게 고려해야 한다."},{"section":"referenceable_claims","quoted_summary_text":"활용 맥락과 주의: 임상에서 수동적이거나 주관적인 외관 검사 대신, 환자의 운동 메커니즘을 보다 명밀하게 추적하기 위해 센서 기반의 정량적 평가가 요구되는 명분을 인용할 때 사용한다.","issue_type":"근거불충분","severity":"경미","explanation":"원문은 임상 방문 중 주관적 시각 관찰 기반 치료와 정량적 생체역학 평가의 최적화 가능성을 말하지만, '수동적 검사', '외관 검사', '운동 메커니즘을 명밀하게 추적'이라는 표현은 해당 인용문만으로 직접 지지되지 않는다.","source_evidence_quote":"Since the treatment is currently based on subjective visual observations during clinical visits, there is huge potential to further optimize the training of patients using quantitative assessment of relevant biomechanical parameters.","source_locator":"PAGE 2, 1. Introduction","suggested_correction":"활용 맥락과 주의: 임상 방문에서 주관적 시각 관찰에 의존하는 ACL 재활 의사결정을 보완하기 위해, 관련 생체역학 변수의 정량 평가 필요성을 제시할 때 사용할 수 있다."}],"unverifiable_items":[{"quoted_summary_text":"- 분석 provider: antigravity","reason":"SOURCE_TEXT에는 기존 요약을 작성한 분석 provider 정보가 제시되어 있지 않아 원문 근거로 확인할 수 없다."}]}