{"provider":"codex","title":"A test battery for evaluating hop performance in patients with an ACL injury and patients who have undergone ACL reconstruction","source_pdf":"/Users/ryutt/Desktop/mini_ryutt/Walking/docs/ref_papers/05_return_to_sport_and_functional_tests/A test battery for evaluating hop performance in patients with an ACL injury and patients who have undergone ACL reconstruction.pdf","source_summary_path":"/Users/ryutt/Desktop/mini_ryutt/Walking/2026-06-29-Study-review/mds/papers/40_A_test_battery_for_evaluating_hop_performance_in_patients_with_an_ACL_injury_and_patients_who_have_undergone_ACL_reconst.md","sections_checked":27,"issues_found":2,"overall_verdict":"일부 수정 필요","overall_verdict_reason":"대부분의 요약은 원문과 일치하지만, 분석 provider처럼 원문에서 확인할 수 없는 항목이 있고, 임상적 기여 표현에서 원문보다 강한 해석이 포함되어 일부 수정이 필요하다.","findings":[{"section":"study_solution_and_contribution","quoted_summary_text":"이 테스트 배터리는 개별 홉 테스트보다 개별 성능 결함을 더 잘 잡아내어, ACL 손상 후 11개월 및 재건술 후 6개월 환자 중 오직 10%만이 홉 성능이 정상 회복되었다는 사실을 폭넓게 밝혀내어 임상적 판단 기준의 신뢰도를 높였다. _(근거: PAGE 1, Abstract)_","issue_type":"과장","severity":"경미","explanation":"원문은 테스트 배터리가 개별 테스트보다 높은 값을 보였고 10명 중 1명만 회복된 홉 수행을 보였다고 결론내리지만, 이것이 ‘임상적 판단 기준의 신뢰도를 높였다’고 직접 주장하지는 않는다. 오히려 실제 의사결정 기여 능력은 전향적 무작위 연구가 필요하다고 한정한다.","source_evidence_quote":"Further, the test battery produced higher values compared with any of the three hop tests individually revealing that only one out of ten patients had restored hop performance 11 months after an ACL injury and 6 months after ACL reconstruction.","source_locator":"PAGE 1, Abstract; PAGE 9, Discussion","suggested_correction":"이 테스트 배터리는 세 가지 개별 홉 테스트보다 높은 판별 지표를 보였고, ACL 손상 후 평균 11개월 및 ACL 재건술 후 6개월 환자 중 홉 수행 능력이 정상으로 분류된 환자가 10명 중 1명에 불과함을 보여주었다."},{"section":"referenceable_claims","quoted_summary_text":"활용 맥락과 주의: 본 연구가 제시하는 3가지 검사(수직 점프, 거리 홉, 사이드 홉)로 구성된 테스트 배터리가 단일 홉 검사보다 ACL 손상 및 재건술 후 기능 결손을 잡아내는 데 뛰어난 민감도를 보인다는 주장의 직접적 근거로 삼을 수 있다.","issue_type":"과장","severity":"경미","explanation":"원문은 테스트 배터리의 민감도가 높고 세 개 개별 테스트 각각보다 높은 값을 보였다고 서술하지만, ‘뛰어난’이라는 표현은 원문보다 평가적이고 강하다. 또한 ‘기능 결손’이라는 표현보다는 원문의 판정 기준인 비정상 LSI 또는 홉 수행 비대칭을 명시하는 편이 더 정확하다.","source_evidence_quote":"The sensitivity of the test battery, i.e. identifying a patient as abnormal when at least one of the three tests produced an abnormal LSI value, was 87% in the patients with an ACL injury and 91% in the patients who had undergone ACL reconstruction.","source_locator":"PAGE 7, Results","suggested_correction":"활용 맥락과 주의: 본 연구의 세 가지 검사(수직 점프, 거리 홉, 사이드 홉) 배터리가 최소 한 검사에서 비정상 LSI가 나타날 때 ACL 손상 환자 87%, ACL 재건술 환자 91%를 비정상으로 분류했다는 직접 근거로 사용할 수 있다."}],"unverifiable_items":[{"quoted_summary_text":"분석 provider: antigravity","reason":"SOURCE_TEXT에는 요약 작성 또는 분석 provider에 관한 정보가 없어 원문 근거로 확인할 수 없다."}]}