{"provider":"codex","title":"Advances in Gait Alterations and Rehabilitation After Anterior Cruciate Ligament Reconstruction: Biomechanics and Emerging Technologies","source_pdf":"/Users/ryutt/Desktop/mini_ryutt/Walking/docs/ref_papers/02_acl_gait_reviews_meta_analyses/Advances in Gait Alterations and Rehabilitation After Anterior Cruciate Ligament Reconstruction - Biomechanics and Emerging Technologies.pdf","source_summary_path":"/Users/ryutt/Desktop/mini_ryutt/Walking/2026-06-29-Study-review/mds/papers/12_Advances_in_Gait_Alterations_and_Rehabilitation_After_Anterior_Cruciate_Ligament_Reconstruction_Biomechanics_and_Emergin.md","sections_checked":32,"issues_found":5,"overall_verdict":"신뢰 어려움","overall_verdict_reason":"대부분의 주요 요약은 원문과 대체로 일치하지만, 연구 설계·대상 범위 및 레퍼런스 항목에서 원문 인용표기와 참고문헌 매핑 오류가 있고, 일부 항목은 원문 근거만으로 확인되지 않는다. 중대 오류가 포함되어 전체적으로 그대로 신뢰하기 어렵다.","findings":[{"section":"design_and_participants","quoted_summary_text":"전방십자인대 손상 또는 전방십자인대 재건술을 거친 환자를 포함하며, 정량적 보행 분석법과 기능적 보행 결과를 보고한 오리지널 원저(RCT, 코호트, 환자-대조군) 문헌을 대상으로 설정했다. _(근거: PAGE 2, 2.2 | Inclusion and Exclusion Criteria)_","issue_type":"누락","severity":"경미","explanation":"원문은 포함 기준에서 기능적 보행 결과만이 아니라 생체역학적, 신경근, 또는 기능적 보행 관련 결과를 보고한 연구를 포함한다고 명시한다. 요약은 생체역학적·신경근 결과를 생략해 대상 문헌 범위가 좁게 전달된다.","source_evidence_quote":"Reported biomechanical, neuromuscular, or functional gait-­related outcomes;","source_locator":"PAGE 2, 2.2 Inclusion and Exclusion Criteria","suggested_correction":"전방십자인대 손상 또는 전방십자인대 재건술을 거친 환자를 포함하며, 정량적 보행 분석법을 사용하고 생체역학적·신경근 또는 기능적 보행 관련 결과를 보고한 오리지널 원저(RCT, 코호트, 환자-대조군) 문헌을 대상으로 설정했다."},{"section":"key_results","quoted_summary_text":"수술 후 3~6개월의 중간 회복기에서 무릎 굴곡 각도가 일부 회복되더라도, 슬관절 신전 모멘트가 지속적으로 감소되어 있고 슬관절 부하 패턴의 변화가 나타난다. _(근거: PAGE 5, 4.2.2 | Intermediate Recovery Phase (3 to 6Months))_","issue_type":"근거불충분","severity":"경미","explanation":"요약 문장은 원문 내용과 대체로 일치하지만, 제시된 근거 원문은 무릎 굴곡 각도와 모멘트의 지속적 감소만 직접 제시하고, '무릎 굴곡 각도가 일부 회복되더라도' 및 '슬관절 부하 패턴의 변화'를 충분히 지지하지 않는다. 같은 절의 다른 문장이 이 내용을 더 직접적으로 지지한다.","source_evidence_quote":"Biomechanical analyses consistently demonstrate that patients continue to exhibit reduced knee extensor moments and altered knee joint loading patterns in the operated limb during stance, even when sagittal-­plane kinematics such as knee flexion angles appear partially normalized.","source_locator":"PAGE 5, 4.2.2 Intermediate Recovery Phase (3 to 6Months)","suggested_correction":"수술 후 3~6개월의 중간 회복기에는 무릎 굴곡 각도 같은 시상면 운동학이 일부 정상화되어 보이더라도, 수술 limb의 슬관절 신전 모멘트 감소와 슬관절 부하 패턴 변화가 지속될 수 있다."},{"section":"key_results","quoted_summary_text":"양측 파형 분석을 적용하여 생체역학을 평가한 결과, 무릎의 시상면 및 전액면 운동역학적 불일치는 수술 후 1년 시점에도 여전히 뚜렷하게 관찰되었으며, 이는 특히 외사지 과제 수행 중에 도드라졌다. _(근거: PAGE 5, 4.2.3.1 | Persistent Gait Asymmetries and Joint Loading Deviations)_","issue_type":"번역오류","severity":"경미","explanation":"'frontal plane'은 '전액면'이 아니라 '전두면'이며, 'single-limb tasks'는 '외사지 과제'가 아니라 '단일 하지 과제' 또는 '한쪽 다리 과제'로 번역하는 것이 맞다.","source_evidence_quote":"Büttner et al. [9] employed bilateral waveform analyses and confirmed that sagittal and frontal plane kinetic discrepancies were still evident at one year postoperatively, especially during single-­limb tasks.","source_locator":"PAGE 5, 4.2.3.1 Persistent Gait Asymmetries and Joint Loading Deviations","suggested_correction":"양측 파형 분석을 적용하여 생체역학을 평가한 결과, 시상면 및 전두면 운동역학적 불일치는 수술 후 1년 시점에도 여전히 관찰되었으며, 특히 단일 하지 과제 수행 중에 두드러졌다."},{"section":"referenceable_claims","quoted_summary_text":"원문 내 인용표기: [7, 8]","issue_type":"인용표기오류","severity":"중대","explanation":"요약의 레퍼런스 항목 5는 Islam et al.의 웨어러블 IMU 검증 연구를 다루지만, 원문 문장은 'Islam et al. [7, 8]'로 표기되어 있어 본문상 인용표기는 [7, 8]이다. 그러나 참고문헌 목록에서 [7]은 Islam et al.이 아니라 Jarchi et al.의 accelerometry-based gait analysis review이고, [8]만 Islam et al.의 MoJoXlab 검증 연구다. 따라서 'Islam et al. [7, 8]' 자체는 원문 본문과 일치하지만, 요약이 이를 Islam 등의 연구에 대한 정확한 선행문헌 매핑처럼 제시하면 참고문헌 7의 저자와 불일치한다.","source_evidence_quote":"7. D. Jarchi, J. Pope, T. K. M. Lee, L. Tamjidi, A. Mirzaei, and S. Sanei, “A Review on Accelerometry-­ Based Gait Analysis and Emerging Clinical Applications,” IEEE Reviews in Biomedical Engineering 11 (2018): 177–194, https://​doi.​org/​10.​1109/​RBME.​2018.​2807182.\n8. R. Islam, M. Bennasar, K. Nicholas, et al., “A Nonproprietary Move-mentAnalysisSystem(MoJoXlab)BasedonWearableInertialMeasure-ment Units Applicable to Healthy Participants and Those With Anterior Cruciate Ligament Reconstruction Across a Range of Complex Tasks: Validation Study,” JMIR mHealth and uHealth 8, no. 6 (2020): e17872, https://​doi.​org/​10.​2196/​17872​.","source_locator":"PAGE 7, References 7–8","suggested_correction":"원문 내 표기는 [7, 8]이나, Islam et al. 연구 자체에 해당하는 참고문헌은 [8]이며 [7]은 Jarchi et al.의 가속도계 기반 보행 분석 리뷰임을 구분해 기록한다."},{"section":"referenceable_claims","quoted_summary_text":"해당 선행문헌: 7. D. Jarchi, J. Pope, T. K. M. Lee, L. Tamjidi, A. Mirzaei, and S. Sanei, “A Review on Accelerometry- Based Gait Analysis and Emerging Clinical Applications,” IEEE Reviews in Biomedical Engineering 11 (2018): 177–194, https://doi.org/10.1109/RBME.2018.2807182. / 8. R. Islam, M. Bennasar, K. Nicholas, et al., “A Nonproprietary MovementAnalysisSystem(MoJoXlab)BasedonWearableInertialMeasurement Units Applicable to Healthy Participants and Those With Anterior Cruciate Ligament Reconstruction Across a Range of Complex Tasks: Validation Study,” JMIR mHealth and uHealth 8, no. 6 (2020): e17872, https://doi.org/10.2196/17872.","issue_type":"인용표기오류","severity":"중대","explanation":"요약은 'Islam 등'이 수행한 IMU 측정 타당성 연구의 해당 선행문헌으로 [7]과 [8]을 함께 제시하지만, 참고문헌 [7]은 Islam et al.이 아니라 Jarchi et al.의 리뷰 논문이다. 이 항목의 핵심 근거 연구를 특정할 때 [7]까지 동일 연구처럼 매핑하는 것은 부정확하다.","source_evidence_quote":"8. R. Islam, M. Bennasar, K. Nicholas, et al., “A Nonproprietary Move-mentAnalysisSystem(MoJoXlab)BasedonWearableInertialMeasure-ment Units Applicable to Healthy Participants and Those With Anterior Cruciate Ligament Reconstruction Across a Range of Complex Tasks: Validation Study,” JMIR mHealth and uHealth 8, no. 6 (2020): e17872, https://​doi.​org/​10.​2196/​17872​.","source_locator":"PAGE 7, References 8","suggested_correction":"해당 선행문헌은 Islam et al.의 MoJoXlab 검증 연구인 참고문헌 [8]로 특정하고, [7]은 가속도계 기반 보행 분석 및 임상 적용에 관한 별도 리뷰 문헌으로 구분한다."}],"unverifiable_items":[{"quoted_summary_text":"원본 파일: /Users/ryutt/Desktop/mini_ryutt/Walking/docs/ref_papers/02_acl_gait_reviews_meta_analyses/Advances in Gait Alterations and Rehabilitation After Anterior Cruciate Ligament Reconstruction - Biomechanics and Emerging Technologies.pdf","reason":"SOURCE_TEXT에는 로컬 원본 파일 경로 정보가 포함되어 있지 않아 원문 근거만으로 확인할 수 없다."},{"quoted_summary_text":"분석 provider: antigravity","reason":"SOURCE_TEXT에는 요약 생성 또는 분석 provider 정보가 포함되어 있지 않아 원문 근거만으로 확인할 수 없다."},{"quoted_summary_text":"기존 연구 방법론의 강점과 한계를 평가함으로써 재활 프로토콜을 최적화하고 장기 합병증을 완화하는 보행 분석의 역할을 명확히 하는 것을 목표로 한다. _(근거: PAGE 1, ABSTRACT)_","reason":"문장 내용은 SOURCE_TEXT의 ABSTRACT에서 확인되지만, '근거: PAGE 1'처럼 요약 내부에 붙은 페이지 표기 및 evidence_quote의 정확한 줄바꿈·하이픈 표기는 원문 추출 텍스트와 일부 형식 차이가 있어 별도 원본 PDF 없이는 완전 검증할 수 없다."}]}